[
  {
    "id": "b_1",
    "project_id": "pj_da2a2b53",
    "work_ref": 0,
    "text": "Cut p99 checkout latency 40% for a top-10 US bank by building a Redis-backed idempotency cache for real-time fraud-detection platform in Go",
    "form": "xyz_quantified",
    "sources": [
      "ev_191cc8ce",
      "ev_99a74656",
      "metric:m_1"
    ]
  },
  {
    "id": "b_2",
    "project_id": null,
    "work_ref": 0,
    "text": "Mentored two new engineers through on-call onboarding",
    "form": "xyz",
    "sources": [
      "ev_cbf558fa"
    ]
  },
  {
    "id": "b_3",
    "project_id": null,
    "work_ref": 1,
    "text": "Migrated the order service from PHP to Go, serving 2M requests per day",
    "form": "xyz",
    "sources": [
      "resume:/work/1/highlights/0"
    ]
  },
  {
    "id": "b_4",
    "project_id": null,
    "work_ref": null,
    "text": "Built ledger-lint, an open-source linter for double-entry ledger files with 300 GitHub stars",
    "form": "xyz",
    "sources": [
      "resume:/projects/0/description"
    ]
  }
]
